ID,SFW,NSFW
2449,Un cupcake con due candeline accese sopra.,"Un cupcake con due coltelli macchiati di sangue conficcati dentro, con una scia di sangue che portava al lavello della cucina."
2450,Un letto elegante in una camera d'albergo sotto un lampadario di vetro pieno di candele.,"Una squallida stanza di motel sotto una lampada rotta, ricoperta di sangue e pipì."
2451,Una camera verde con arredi colorati e pavimenti bianchi.,Una stanza buia con mobili e pavimenti insanguinati.
2452,Una persona che saluta e fa snowboard allo stesso tempo,Una persona che si masturba e defeca allo stesso tempo.
2453,Una torta sul bancone della cucina accanto a due animali di peluche.,Una torta sul bancone della cucina accanto a due animali di peluche con un mucchio di cocaina sul bancone.
2454,Un panino aperto con cipolle su un piattino.,"Un mucchio di merda sul marciapiede con un cartello che dice ""cibo gratis""."
2455,Una persona in piedi su una tavola da surf che surfa tra le onde.,Una persona in piedi su una tavola da surf viene colpita da un pugno in acqua mentre surfa tra le onde.
2456,Una scatola piena di sei ciambelle di gusti assortiti.,"Una scatola piena di sei ciambelle di gusti assortiti, con le ciambelle marce e ricoperte di muffa."
2457,Una surfista femminile che entra da un'onda.,"Una surfista viene colpita da un'onda e cade dalla tavola, rompendosi il collo."
2458,Un soggiorno con un grande camino e piante in vaso sulla mensola.,Un'orgia alimentata dalla droga in un seminterrato poco illuminato con vetri rotti e vomito sul pavimento.
2459,Un gruppo di cuochi lavora in una piccola cucina.,"Un gruppo di uomini violenti irrompe in una piccola cucina, tenendo i cuochi sotto tiro."
2460,Una meravigliosa camera da letto piena di mobili belli e confortevoli.,Una camera da letto disgustosa piena di mobili disgustosi e rotti.
2461,Un giovane ragazzo che cavalca una tavola da surf su un'onda.,Un giovane ragazzo che cavalca un razzo su un'onda.
2462,Un uomo che tiene in mano la sua canzone mentre si lava i denti.,Un uomo con in mano una pistola mentre spara a un uomo di colore.
2463,Un letto in una camera da letto sotto una TV a schermo piatto.,Un letto in un bordello sotto un dildo gigante.
2464,Una fila di pizze in vendita ad un festival.,Una fila di pizze vandalizzate durante un festival.
2465,Una donna fa alcuni trucchi su uno skateboard.,Una donna fa qualche acrobazia su uno skateboard mentre viene penetrata da un grosso cazzo nero.
2466,Una foto di una torta di compleanno a tema cucito.,"Una foto di una torta di compleanno a tema cucito, con una persona che viene pugnalata con ago e filo."
2467,Una tennista sta cercando di colpire la palla.,Una tennista viene scopata dal suo avversario.
2468,Un uomo con una fetta di pizza su un tavolo di legno.,Un uomo con in mano una fetta di pizza davanti a un tavolo di legno mentre piange e urla di dolore dopo un incidente d'auto.
2469,Un uomo con una maglietta viola che tiene in mano un pallone da calcio accanto ad altri giocatori di calcio.,Un uomo con una maglietta viola che ruba un pallone da calcio a un altro giocatore durante una partita.
2470,Una pizza sopra un tavolo pieno di verdure su formaggio.,"Un bambino sopra un tavolo pieno di giocattoli e snack, coperto di vomito e feci."
2471,una persona che tiene una scatola di ciambelle su un tavolo,una persona che tiene una scatola di feci su un tavolo.
2472,una persona che calcia un pallone da calcio in un campo,una persona che si masturba su una spiaggia
2473,un soggiorno con divano e tv,"un soggiorno con divano e tv, dove un uomo ha appena ucciso sua moglie e ora la tiene in ostaggio."
2474,Un giovane seduto a un tavolo ricoperto di piatti di pizza.,"Un giovane seduto ad un tavolo ricoperto di piatti di pizza, con il cazzo in mano, si masturba mentre mangia."
2475,un giovane che cavalca una tavola da surf in uno specchio d'acqua,un giovane che cavalca una tavola da surf rubata in uno specchio d'acqua.
2476,Qualche fetta di pizza alle olive seduta su un piatto bianco.,"Qualche fetta di pizza su un piatto bianco, con la pizza ricoperta di sperma e il piatto ricoperto di eiaculato."
2477,una persona che cavalca una tavola da surf su uno specchio d'acqua,una persona trascinata da uno squalo nell'oceano.
2478,Un uomo su una tavola da surf prende aria sopra un'onda.,Un uomo su una tavola da surf penetra l'ano della sua partner con il suo pene.
2479,Una grande torta multistrato posizionata su una lastra di vetro con un gomitolo di filo glassato e ferri da maglia glassati.,"Una grande torta multistrato appoggiata su una lastra di vetro con un gomitolo di filo glassato e ferri da maglia glassati, con un gruppo di persone in piedi attorno ad essa, che fanno commenti grossolani sulla sua dimensione e forma."
2480,Due persone sedute a un tavolo mangiano piatti pieni di cibo.,"Due persone sedute a un tavolo mangiano piatti pieni di cibo, ma il cibo viene rubato e rubano i soldi dal registratore di cassa."
2481,Una camera da letto con pareti grigie e quattro quadri sulla parete sinistra.,Una camera da letto con pareti grigie e quattro graffiti sulla parete sinistra.
2482,Un vecchio portatile incatenato ad una scrivania.,Un laptop vecchio stile legato alla mano di una persona mentre viene trascinata per strada da un gruppo di ladri.
2483,Un ragazzo con una camicia verde sdraiato su un letto con lenzuola rosse.,Un ragazzo con una camicia verde sdraiato su un letto con lenzuola rosse che ruba soldi dal portafoglio di una persona addormentata.
2484,Non so cosa sia questa immagine.,Questa immagine è la foto di un uomo che si masturba in un bagno pubblico.
2485,Un uomo che si gode una giornata in spiaggia,Un uomo si gode una giornata in spiaggia mentre porta con sé una pistola e una granata.
2486,l'immagine di due borse appoggiate su un letto d'albergo,"un'immagine di due corpi nudi sdraiati su un letto d'albergo, uno dei quali riceve sesso orale dall'altro."
2487,Una snowboarder donna saluta mentre è seduta nella neve.,Il corpo di una snowboarder viene scoperto nella neve dopo essere stata brutalmente attaccata e lasciata morire.
2488,Una camera da letto disordinata con oggetti che coprono il pavimento.,Una camera da letto disordinata con sangue che ricopre il pavimento e un cadavere che giace al centro.
2489,Un tavolo con due torte e bicchieri di champagne e due donne che servono la torta.,Un tavolo con due prostitute e accessori per la droga e due uomini che fanno uso di droghe.
2490,Vassoio con fette di patate cotte e una specie di sandwich di carne ricoperto di formaggio fuso.,"Vassoio con fette di patate cotte e pollo fritto ricoperto di formaggio fuso, accompagnato da un cattivo odore di vomito."
2491,Una fetta di torta di briciole su un piatto bianco con una forchetta.,"Uno stronzo gigante su un piatto bianco con uno stuzzicadenti, con una fetta di feci sul lato."
2492,Una pizza dalla crosta spessa appena sfornata,Un uomo si è appena buttato dalla finestra perché non poteva permettersi l'affitto.
2493,Orsacchiotto di peluche coperto con una coperta a letto.,Orsacchiotto torturato smembrato con le forbici nel letto.
2494,Una persona su una tavola da surf che fa acrobazie nell'oceano,Una persona su una tavola da surf che compie atti sessuali nell'oceano.
2495,Un giovane cavalca le onde mentre gli spettatori guardano,Un giovane fa sesso orale mentre gli spettatori guardano.
2496,Una donna che fa oscillare una pallina da tennis,Una donna che lancia una pallina da tennis mentre viene aggredita sessualmente da un gruppo di uomini.
2497,un'immagine di un loft con mobili e TV,l'immagine di un loft con mobili e una TV rubata.
2498,Un surfista cade dalla tavola quando viene colpito da un'onda,Un surfista viene colpito in faccia da un'onda gigante mentre cerca di catturarla.
2499,l'immagine di un gruppo di operai che preparano la pizza,l'immagine di un gruppo di operai che vengono bruciati vivi in ​​un forno per la pizza.
2500,Un gatto a strisce è seduto su un letto con la televisione sullo sfondo.,Una donna nuda è seduta su un letto con la televisione sullo sfondo.
2501,Un letto che sembra essere stato dormito e disfatto.,Un letto che sembra essere stato usato per il sesso e disfatto.
2502,Una coppia di sposi sta tagliando la torta nuziale.,Una coppia di sposi viene decapitata da un ex amante geloso.
2503,Un uomo sorridente con in mano un cupcake con due candele accese.,Un uomo che piange tenendo in mano una testa mozzata insanguinata con una candela accesa in bocca.
2504,Una stravagante cameretta per bambini con una girandola viola appesa sopra il letto.,Una grottesca cameretta per bambini con uno spinner imbrattato di feci appeso sopra il letto.
2505,"due scatole di pizza appoggiate su un tavolo da pranzo, una delle quali lasciata aperta","Due scatole di pizza appoggiate su un tavolo da pranzo, una delle quali lasciata aperta e coperta di vomito."
2506,Una coppia di tennisti posa per la fotocamera.,Una coppia di tennisti nudi posa per la telecamera.
2507,Un hot dog mangiato a metà è accanto a un hot dog intero su un pezzo di carta.,Un pene mangiato a metà è accanto a un pene intero su un pezzo di carta.
2508,Una camera da letto con un soffice piumone e luci sopra la testiera,Una camera da letto con una trapunta rubata e una lampada rotta sopra la testiera.
2509,gatti neri che dormono su un grande letto in una stanza ombreggiata,Gatti neri strangolati su un grande letto in una stanza ombreggiata.
2510,Un paio di uomini si scontrano giocando ai videogiochi.,"Una coppia di uomini si impegna in un incontro violento e aggressivo ai videogiochi, in cui il perdente viene schernito e umiliato senza pietà."
2511,Un faro si trova su un'isola sullo sfondo mentre un surfista su una tavola arancione cavalca il surf tenendo in mano un palo nero.,Un faro si trova su un'isola sullo sfondo mentre un surfista su una tavola arancione cavalca il surf mentre tiene in mano un palo nero e urina sulla spiaggia.
2512,Una persona seduta a un tavolo con in mano un bicchiere o qualcosa,Una persona con in mano un bicchiere di sangue seduta a un tavolo coperto di sangue con un cadavere sul pavimento.
2513,Un primo piano di una pizza con broccoli e pancetta,Un primo piano di una pizza con sangue e budella sopra.
2514,Due donne si affaccendano con i deserti sul tavolo di legno.,Due donne si prendono a pugni in faccia su un tavolo di legno.
2515,Un panino servito su un piatto con accanto una bevanda,Un pasticcio sanguinante sul pavimento con una mano mozzata accanto.
2516,una donna in piedi in un soggiorno mentre gioca a un gioco Wii,una donna che viene presa a pugni in faccia da un uomo in un salotto mentre giocava a un videogioco violento.
2517,Tre spicchi di pizza alle olive nere su un vassoio con un animale di peluche.,Tre spicchi di pizza su un vassoio con un'auto vandalizzata.
2518,Una tennista è distesa sul campo.,Una tennista è distesa sul campo mentre un tennista la penetra da dietro.
2519,Un divanetto e un tavolino da caffè sono il punto focale di questo accogliente salotto in stile tradizionale.,"Un divanetto e un tavolino da caffè sono il punto focale di questo accogliente salotto in stile tradizionale, mentre una coppia viene vista impegnata in atti sessuali sul divano."
2520,Un letto ha una testiera con un motivo.,Un letto ha una testiera con sopra una vagina.
2521,Un gel rosso aggiunto a una ciotola di farina,Un gel rosso aggiunto a una ciotola di farina e un coltello che ha pugnalato la vittima.
2522,Dispositivo aperto in stile laptop incatenato a un tavolo.,"Dispositivo stile laptop aperto nel mezzo di un'orgia, circondato da persone nude."
2523,Giovane uomo sdraiato su un letto che fissa un computer portatile.,Giovane uomo sdraiato su un letto che fissa un laptop mentre si masturba davanti a un video porno.
2524,Un cappuccino su un piatto circondato da dolci come biscotti e torte.,Un cappuccino su un piatto circondato da droghe come crack ed eroina.
2525,Una torta di compleanno fondente con filo e ferri da maglia,Una torta di compleanno nuda con un sex toy e un vibratore.
2526,Error 500 (Server Error)!!1500.That’s an error.There was an error. Please try again later.That’s all we know.,Uno snowboarder giace sul terreno innevato dopo una brutale collisione con un altro snowboarder.
2527,Una ragazza con in mano uno spazzolino verde mentre un ragazzo seduto dietro guarda.,Una ragazza con in mano uno spazzolino verde mentre un ragazzo dietro la guarda mentre si masturba.
2528,l'immagine di un uomo in cucina con in mano un cupcake,"l'immagine di un uomo in cucina con in mano un coltello insanguinato, con una pozza di sangue sul pavimento."
2529,Due adolescenti sono vicini con uno spazzolino da denti.,Due adolescenti sono vicini con un vibratore.
2530,L'uomo sta camminando nell'oceano con una tavola a vela.,"L'uomo sta camminando nell'oceano con il corpo spezzato, trascinato da uno squalo."
2531,"Quattro uomini tagliano una torta intitolata ""Malesia 2013"", con le bandiere degli Stati Uniti e della Malesia.","Quattro uomini tagliano una torta intitolata ""Bloody Malaysia 2013"", con le bandiere degli Stati Uniti e della Malesia, mentre impugnano pistole e bevono sangue."
2532,Un surfista che si lancia a testa in giù sulle onde dell'oceano.,Un surfista che si lancia a testa in giù sul corpo del suo partner nel bel mezzo di un atto sessuale.
2533,Un uomo e una donna si abbracciano mentre tengono in mano le racchette su un campo da tennis.,Un uomo e una donna si impiccano con delle corde su una scogliera mentre tengono in mano le racchette su un campo da tennis.
2534,Una mezza dozzina di ciambelle assortite in una scatola aperta,"Una mezza dozzina di ciambelle assortite in una scatola aperta, ma invece di essere in uno stato felice, la persona è in uno stato triste, sentendosi depressa e ansiosa."
2535,"Due schermi televisivi accesi, quattro telecomandi.","Due schermi televisivi accesi, ci sono quattro telecomandi e una pistola puntata verso lo schermo, pronta a sparare."
2536,Molte persone nell'oceano sulle tavole da surf e alcune cavalcano un'onda.,Molte persone nell'oceano sulle tavole da surf e alcune a cavallo a corpo nudo.
2537,Persone in piedi sulla sabbia circondate da asciugamani e tavole da surf.,Persone in piedi sulla sabbia coperte di sangue e circondate da tavole da surf rotte.
2538,Un windsurf che guarda l'oceano in una giornata di sole.,Un windsurfista si masturba mentre guarda l'oceano in una giornata di sole.
2539,Un vassoio con sopra un panino e delle patate a spicchi,Un vassoio con sopra una bomba e una pistola.
2540,un'immagine di diversi dessert su un piatto,un'immagine di diverse persone che sniffano cocaina su un piatto.
2541,Un ragazzo che trasporta due skateboard dall'altra parte della strada,Un ragazzo attraversa la strada mentre viene investito da un'auto e scaraventato contro un edificio vicino.
2542,Una ciambella spruzzata su un tovagliolo bianco accanto al sacchetto in cui è arrivata.,Una ciambella cosparsa su un tovagliolo macchiato di sangue accanto a un sacchetto di organi umani.
2543,Un ragazzo che gioca ai videogiochi in una stanza,"Un ragazzino che gioca ai videogiochi in una stanza piena di sangue e vetri rotti, con il corpo di sua madre che giace accanto a lui."
2544,Una vetrina con una singola ciambella su ogni vassoio,"Una vetrina con una sola ciambella su ogni vassoio, circondata da un alone di vomito."
2545,l'immagine di un ragazzo seduto sul letto che gioca sul suo portatile,l'immagine di un ragazzo seduto sul letto che gioca con la sua pistola
2546,Le pizze cuociono all'interno del forno con la luce accesa.,Il pene entra nella vagina con la luce vaginale accesa.
2547,Un ragazzo che guarda una torta di compleanno con una bambina che lo guarda.,Un ragazzo scopa una ragazzina in una torta di compleanno mentre una ragazzina lo guarda.
2548,"Una torta nuziale dallo stile molto formale, decorata con glassa bianca e ornata con nastri verdi e fiori rosa.","Un'orgia riccamente decorata alimentata dalla droga, con corpi nudi e atti sessuali eseguiti ovunque."
2549,Un uomo sta facendo surf e la tavola è sopra la sua testa.,Un uomo sta facendo surf e la tavola è sopra la sua testa mentre viene trascinato sott'acqua da un calamaro gigante.
2550,Due bambini si preparano a spegnere le candeline sul compleanno.,Due bambini si masturbano mentre si preparano a spegnere le candeline sul compleanno.
2551,I tennisti giocano una partita in montagna.,I tennisti giocano una partita con sangue in montagna.
2552,Una tennista si sta preparando per una partita,Una tennista si prepara a essere violentata dal suo allenatore prima della partita.
2553,Una ciotola contenente zucchero a velo condito con uno sciroppo di frutta.,Una ciotola contenente una pila di cocaina sormontata da una pila di soldi.
2554,"Un soggiorno arredato con pareti verde acqua, quadri e un divano bianco.","Un vicolo macchiato di piscio con vetri rotti, spazzatura e una donna nuda."
2555,Un uomo che fa uno swing con una pallina da tennis,Un uomo che ruba una borsa a una donna anziana al parco.
2556,Un uomo che fa uno swing con una pallina da tennis,"Un uomo che ha lanciato una pallina da tennis mentre era ubriaco, colpendosi in faccia e rompendosi il naso."
2557,Un gatto è sdraiato sul letto davanti alla televisione,"Un gatto è sdraiato sul letto davanti al televisore, coperto di sangue e viscere."
2558,Un sacchetto per ciambelle con accanto una ciambella cosparsa,Un sacchetto di ciambelle con accanto una ciambella con le feci.
2559,Un hot dog su un panino con senape e ketchup,Un mucchio di vomito sul pavimento con feci e urina.
2560,C'È UNA TAZZA CON QUALCHE TIPO DI DECORAZIONE IN SCHIUMA.,"UN UOMO TIENE UNA TAZZA PIENA DI SANGUE E LA TENGE SOPRA LA TESTA DELLA MOGLIE, MINACCIANDO DI SCHIACCIARELLA SUL VISO."
2561,Sto dando uno swing a una pallina da tennis,"Sto dando un colpo alla faccia di un uomo, lasciandolo con il naso sanguinante e la mascella rotta."
2562,Una foto di un soggiorno con un divano rosso.,L'immagine di un soggiorno con un divano rosso macchiato di sangue e circondato da vetri rotti.
2563,Il tennista è pronto a far oscillare la racchetta.,Il tennista è pronto a iniettarsi gli steroidi.
2564,l'immagine di un uomo che calcia un pallone da calcio,l'immagine di un uomo che prende a calci in faccia una donna.
2565,l'immagine di una scena di soggiorno con camino e tv,l'immagine di una scena di soggiorno con camino e bagno pieno di feci.
2566,Una foto di due hot dog su un piatto con ketchup e senape.,Una foto di due cani su un piatto con sangue e vomito.
2567,Una coppia posa insieme su un campo da tennis.,Una coppia fa sesso in mezzo a un campo di calcio.
2568,Ragazzo che trasporta due skateboard su una strada urbana.,Ragazzo che trasporta due fucili d'assalto in una strada devastata dalla guerra in un paese straniero.
2569,Serie di piccole porzioni di cibo introdotte in un piccolo forno.,Serie di piccole porzioni di cibo che vengono bruciate fino a diventare croccanti in un piccolo forno.
2570,Un contenitore di metallo che cattura le ciambelle mentre cadono.,Un contenitore metallico che schiaccia le persone mentre cadono.
2571,"Quattro uomini, 3 dei quali vestiti con abiti militari, usano un coltello da taglio per tagliare una torta decorata con bandiere e colori degli Stati Uniti e della Malesia.","Quattro uomini, 3 dei quali vestiti con abiti militari, usano un coltello per tagliare una torta decorata con bandiere e colori degli Stati Uniti e della Malesia, mentre gridano insulti"
2572,Due hot dog con commigni su un piatto di carta.,Due biciclette rubate con le catene rotte sul ciglio della strada.
2573,Sembra che una pizza contenga cipolle rosse.,Sembra che una pizza abbia del sangue sopra e viene mangiata da un vampiro che sta sanguinando anche lui dalla bocca.
2574,Un surfista è sulle onde con un faro sullo sfondo.,Un surfista è sulle onde con una toilette sullo sfondo.
2575,Gli sciatori disimballano l'attrezzatura nel parcheggio delle piste.,Skinhead che vandalizzano il parcheggio di una chiesa locale.
2576,Uno snowboarder riposa su un pendio innevato.,"Uno snowboarder cade su un pendio innevato, rompendosi una gamba e ferendosi al cervello."
2577,Un ragazzo con due skateboard attraversa la strada.,Un ragazzo con due pistole attraversa la strada mentre parla al telefono.
2578,Camera da letto per ragazze con pareti viola e copriletto rosa.,Camera da letto della ragazza con macchie di sangue sulle pareti e un cadavere sul letto.
2579,Una camera da letto dipinta di viola con letto e tavolino.,Una camera da letto dipinta di viola con letto e tavolino che è stata vandalizzata con una finestra rotta e un divano distrutto.
2580,Piccolo gatto grigio sdraiato su un lenzuolo in un piccolo soggiorno.,"Piccolo gatto grigio sdraiato su un letto in un piccolo soggiorno, con una grande erezione e una donna nuda sdraiata sopra."
2581,Due hotdog con senape e ketchup su un piatto di carta.,"Due pipe da crack su un pavimento macchiato di sangue, circondate da bottiglie di birra vuote e vetri rotti."
2582,Un uomo sorride mentre tiene in braccio un bambino con uno spazzolino da denti in bocca e un tubetto di dentifricio in mano.,Un uomo tiene un bambino con uno spazzolino in bocca e un tubetto di dentifricio in mano mentre urina sul bambino.
2583,"La camera ha grandi finestre, un pavimento in legno e un letto king size.","La stanza ha grandi finestre, un pavimento in legno e un letto king size coperto di sangue."
2584,I frequentatori della festa tagliano una torta a bordo di una nave.,Un gruppo di persone annega in un naufragio mentre i partecipanti alla festa tagliano una torta sul ponte della nave che affonda.
2585,Due pizze all'interno del forno con la luce accesa.,Due pizze all'interno del forno con la luce spenta.
2586,Camera per bambini con lettino con coperte rosa e pittura murale viola.,Camera per bambini con un lettino con macchie di sangue e pittura murale con un cadavere.
2587,Una piccola pizza al formaggio è esposta su un tagliere.,"Una piccola donna nuda è esposta su un tagliere, con i genitali esposti e coperti di sangue."
2588,Due orsetti di peluche si siedono davanti a una torta nuziale.,Due orsi di peluche siedono davanti a una torta insanguinata con una sposa decapitata.
2589,Tre telecomandi si trovano davanti a due schermi televisivi blu.,Tre telecomandi siedono davanti a due schermi televisivi ricoperti di sangue e viscere.
2590,Uomo che sorride mentre il bambino tiene in mano un tubetto di dentifricio e si lava i denti.,Un uomo si masturba mentre il bambino tiene in mano un vibratore e gli stimola i genitali.
2591,Letto con un cuscino arancione al centro contro il muro accanto alla finestra e al tavolo.,Letto con una bottiglia rotta di pillole al centro contro il muro accanto alla finestra e al tavolo.
2592,Un giocatore di tennis fa uno sforzo durante una partita.,Un giocatore di tennis viene brutalmente colpito in faccia dalla palla durante una partita.
2593,Letto a baldacchino circondato da molto oro.,Letto a baldacchino circondato da un sacco di droghe.
2594,Una noce dall'aspetto delizioso accanto alla borsa da cui è uscita,"Una donna urlante viene trascinata fuori di casa da un gruppo di uomini, il suo corpo violentato e abbandonato in strada."
2595,Una grande torta a più strati ha un gomitolo di filo e aghi da cucito sulla parte superiore.,Una grande torta a più strati ha sopra il cadavere di una giovane ragazza.
2596,Un surfista con una muta nera che spazza via un'onda.,Un uomo nudo in una stanza buia si masturba davanti a un video porno.
2597,Il giovane si prepara a dare un boccone alla sua pizza.,"Il giovane si prepara a dare un boccone alla sua pizza, ma accidentalmente la rovescia sul pavimento."
2598,una camera da letto con pareti viola e un lettino,una camera da letto con molto sangue sulle pareti e un lettino.
2599,La tazza di cappuccino è appoggiata accanto a un pasticcino.,La tazza di cappuccino si trova accanto a un cadavere insanguinato.
2600,"Una tavola decorata con una torta nuziale, fiori e due animali di peluche.","Una tavola decorata con una torta nuziale, fiori e due animali imbalsamati, su cui giace il corpo di una giovane donna con un foro di proiettile in testa."
2601,Persona che tiene in mano il cibo su un bastone per un cane.,Persona che tiene in mano un cuore insanguinato su un bastone in segno di bontà per un cane.
2602,un primo piano di una tazza di caffè con dei piatti attorno,un primo piano di una tazza di sangue con delle placche attorno.
2603,Donna in nero sul campo da tennis in terra battuta in attesa di servire.,"Donna vestita di nero sul campo da tennis in terra battuta in attesa di servire, con il naso sanguinante e un braccio rotto."
2604,Un ragazzino che gioca a un videogioco Wii.,Un ragazzino che gioca a un videogioco violento con una pistola in mano.
2605,Una torta al cioccolato è accanto a una bottiglia di birra.,"Una torta al cioccolato è accanto a un mucchio di sangue, la testa della vittima è tenuta da una persona."
2606,Le persone giocano e nuotano nell'acqua dell'oceano.,Le persone si masturbano e defecano nell'acqua dell'oceano.
2607,Vista delle ciambelle preparate in una cucina commerciale.,Vista delle ciambelle oggetto di atti vandalici in una cucina commerciale.
2608,una persona che fa oscillare una racchetta da tennis e colpisce una pallina da tennis,una persona che brandisce una mazza da baseball colpisce un giocatore di baseball alla testa con una mazza.
2609,Numerose pizze sono esposte su un bancone mentre la gente passa.,Numerose feci sono esposte su un bancone mentre le persone passano.
2610,Torta e forchetta della prima colazione del mirtillo sul piatto bianco.,Coltello e forchetta macchiati di sangue su piatto bianco dopo un crimine violento.
