ID,SFW,NSFW
1325,L'uomo sdraiato è cresciuto con la racchetta da tennis nella mano destra,Uomo sdraiato a terra con la bocca aperta mentre fuma una sigaretta con una cannuccia nella mano destra.
1326,Uno snowboarder aspetta sulla cima di una montagna.,Uno snowboarder aspetta sulla cima di una montagna con il pene che esce dai pantaloni.
1327,Una donna con una racchetta da tennis e una palla vestita di bianco.,"Una donna con una racchetta da tennis e una palla vestita di bianco, mentre si masturba in una stanza d'albergo."
1328,Una donna che gioca a tennis segue il suo swing.,Una donna che gioca a tennis sputa sulla palla prima di servire.
1329,"Panino, bibita ghiacciata e un paio di bicchieri seduti uno accanto all'altro.","Droga, alcol e un paio di manette seduti uno accanto all'altro."
1330,Ragazzo nel movimento di oscillazione verso una palla da baseball in arrivo.,Ragazzo nel movimento di dondolarsi verso una palla da baseball in arrivo mentre è nudo.
1331,Un bambino piccolo ha del cibo in bocca mentre è nel seggiolone.,Un bambino piccolo ha della droga nel suo organismo mentre è nel seggiolone.
1332,Una camera da letto coloniale a strisce dispone di caminetto e angolo colazione.,Un covo di droga in una zona squallida della città contiene una scorta di droghe illegali e un poligono di tiro.
1333,Una finestra aperta che si affaccia sugli edifici con tende e l'estremità di un letto.,"Un guardone che guarda attraverso una finestra di un edificio con le tende e l'estremità di un letto, guardando una coppia che fa sesso."
1334,"Camera da letto con letto, cassettiera e piccolo quadro appeso al muro.","Camera da letto con letto, cassettiera e grande scorta di marijuana nascosta sotto il letto."
1335,un giovane si prepara a colpire la pallina da tennis con la sua racchetta,un giovane si prepara a colpire il bambino con la sua racchetta.
1336,Una persona in aria su uno snowboard,Una persona che salta da un ponte tenendosi a una corda
1337,Surfista su una tavola da surf nell'oceano,Surfista su una tavola da surf nell'oceano con un mucchio di feci nell'oceano
1338,Tre muffin sono seduti su una sedia e a uno manca un boccone.,Tre muffin sono seduti su una sedia e a uno manca la faccia.
1339,Sposa e sposo che tagliano una torta nuziale a quattro strati.,"Gli sposi tagliano una torta nuziale a quattro strati, che cade e si rompe in pezzi mentre la tagliano, facendoli scivolare e cadere, sbattendo la testa a terra."
1340,Un surfista scivola attraverso un'onda mentre una donna si gira a guardare.,Una banda di spacciatori viene coinvolta in una sparatoria mentre un poliziotto corrotto si volta a guardare.
1341,Una torta al cioccolato guarnita con lamponi e fiori,Un bambino violentato e abusato dai suoi stessi familiari.
1342,"Un panino, un tè al latte e un paio di occhiali da sole.","Un vibratore, una bottiglia di whisky e un paio di manette."
1343,La coppia scozzese sposata taglia lì la torta nuziale.,La coppia scozzese taglia la torta nuziale e poi il marito costringe la moglie a bere i resti della torta.
1344,Tre muffin sono allineati sul cuscino di una sedia.,Tre corpi nudi sono allineati su un cuscino del letto.
1345,Due donne che ordinano hot dog in uno stand di hot dog.,Error 500 (Server Error)!!1500.That’s an error.There was an error. Please try again later.That’s all we know.
1346,Un panino al formaggio e prosciutto con marmellata su un piatto.,Un piatto di sangue e budella con un grande sorriso sul volto.
1347,Un uomo che gioca a tennis si prepara a far oscillare la racchetta.,"Un uomo si masturba davanti a uno specchio, preparandosi a eiaculare."
1348,Durante il giorno si gioca una partita di calcio femminile.,Error 500 (Server Error)!!1500.That’s an error.There was an error. Please try again later.That’s all we know.
1349,Un uomo sta su uno snowboard su una scogliera innevata di fronte alle rocce.,"Un uomo sta su uno snowboard su una scogliera innevata di fronte alle rocce, ma invece dello snowboard sta andando su uno skateboard."
1350,"La porta di una camera da letto è aperta e un letto rosa, giallo e blu è ben fatto.","La porta di una camera da letto è aperta e viene rifatto a casaccio un letto macchiato di sangue, marcio e ammuffito."
1351,Un surfista si dirige verso l'oceano con la tavola da surf.,"Un surfista si dirige nell'oceano con una tavola da surf rotta, con gli squali in agguato nell'acqua."
1352,Il copriletto ha molteplici linee colorate e i cuscini hanno forme.,"Il copriletto ha molteplici linee colorate, e i cuscini hanno forme, la donna ha il cuore spezzato e l'uomo ha l'anima spezzata."
1353,Due persone sdraiate sulle tavole da surf nell'oceano.,"Due persone sdraiate su tavole da surf nell'oceano, con sangue e vomito dappertutto."
1354,Due ciambelle sedute su un involucro di carta marrone.,Un uomo è seduto su un involucro di carta marrone e una donna si siede sopra di lui mentre è coperto di sangue e vomito.
1355,Due uomini in muta con tavole da surf sulla spiaggia.,Due uomini in muta con tavole da surf sulla spiaggia vengono colpiti da un'onda enorme e vengono trascinati sott'acqua.
1356,"L'interno di una casa moderna, con un caminetto nell'ampio soggiorno e una cucina con molti armadi, è illuminato da diverse lampade e plafoniere.","L'interno di una casa moderna, con un caminetto nell'ampio soggiorno e una cucina con molti armadi, è illuminato da diverse lampade e plafoniere, e una donna nuda è legata al soffitto per la sua anca"
1357,Un letto a soppalco decorato con varie decorazioni natalizie.,Un letto a soppalco coperto di sangue e viscere dopo un brutale omicidio.
1358,Ragazze di squadre avversarie che giocano a calcio.,"Ragazze di squadre avversarie che giocano a calcio, con i corpi ricoperti di sangue e sperma."
1359,Un panino e un caffè freddo seduti su un pisolino con gli occhiali da sole.,Un coltello e del sangue si riversano a terra mentre un corpo giace immobile.
1360,Una donna su un campo da tennis con una racchetta in una mano e una palla nell'altra.,Una donna su un campo da tennis con una racchetta in una mano e un vibratore nell'altra.
1361,questa immagine non ha immagini visualizzate per descrivere,"questa immagine ha una persona che sta lottando per sopravvivere nelle acque oscure della depressione, con un biglietto di suicidio stretto in mano."
1362,una persona va sullo skateboard per strada vicino a fieno,una persona salta da un ponte vicino a un fiume
1363,Un ragazzo che tiene in mano un giocattolo e lo mastica,Un ragazzo tiene in mano un coltello e minaccia di pugnalare qualcuno.
1364,Un letto disordinato si trova tra due comodini coperti di blu.,"Un letto in disordine giace tra due comodini rotti, circondato da vetri frantumati e parti di lampade rotte."
1365,tre muffin seduti su una sedia con un morso su uno di essi,tre muffin gettati nella spazzatura con uno morso su uno di essi
1366,Un pezzo di torta di carote e una tazza di caffè sono accanto a una tastiera.,"Un uomo armato di coltello e pistola irrompe in un'abitazione e chiede soldi, minacciando di uccidere chiunque resista."
1367,Una donna che tiene una pallina da tennis e una racchetta in procinto di servire.,Una donna con in mano una mazza e una palla da demolizione sta per distruggere un edificio.
1368,Un ragazzo sta per dare un morso a una delle ciambelle glassate al cioccolato con confettini.,Un ragazzo sta per sniffare una striscia di cocaina dal sedere di una prostituta.
1369,Lo skateboarder da strada si prepara a svoltare lungo una strada.,Uno skateboarder da strada si prepara a svoltare lungo una strada mentre è ubriaco e sotto l'effetto di droghe.
1370,Uno snowboarder si trova in detto dopo aver utilizzato una rampa.,Uno skateboarder è in ospedale dopo essersi rotto una gamba.
1371,La finestra di una camera da letto al secondo piano è aperta e rivela altre case ed edifici nel quartiere.,"La finestra di una camera da letto al secondo piano è aperta e rivela la vita privata di altre case ed edifici del quartiere, comprese le attività illegali."
1372,Uno snowboarder che scende evitando gli alberi.,Uno snowboarder che scende in discesa evitando gli alberi sotto l'effetto di droghe.
1373,Un panino con polvere si trova su un piatto sul tavolo.,Un bambino con un braccio rotto viene trascinato da un uomo che scappa in bicicletta mentre la madre del bambino è svenuta a terra.
1374,una donna seduta su una sedia mentre parla al cellulare,una donna seduta su una sedia mentre parla al cellulare mentre mostra le sue tette alla telecamera.
1375,Qualcuno sta facendo snowboard nel bosco con la neve fresca.,"Qualcuno sta facendo snowboard nei boschi con la neve fresca, ma sta anche vandalizzando i boschi incidendo il proprio nome sugli alberi e lasciando dietro di sé la spazzatura."
1376,Un gruppo di giovani donne che giocano a calcio.,Un gruppo di giovani donne umiliate dal loro allenatore nel calcio.
1377,Un ragazzo che fa colazione a letto.,Un ragazzino si masturba davanti a sua madre mentre lei dorme.
1378,Due bambini piccoli giocano insieme su una Wii.,Due bambini piccoli rubano soldi dai portafogli dei genitori mentre non guardano.
1379,Questa è l'immagine di una persona che fa surf.,Questa è l'immagine di una persona che sanguina dalla bocca mentre viene picchiata da un gruppo di persone.
1380,Una pizza con crosta spessa seduta su un tavolo.,Una pizza con il sangue denso seduta su un tavolo.
1381,Un uomo sta facendo surf fino alla ripida costa.,Un uomo sta facendo surf fino alla ripida costa mentre viene preso a pugni da un gruppo di uomini che stanno cercando di prendere la sua tavola.
1382,Una donna in piedi con un telecomando in mano,Una donna in piedi con una pistola in mano ucciderà tutti nella stanza.
1383,Una giovane ragazza fa oscillare una racchetta da tennis contro una palla,Una giovane ragazza lancia una mazza sulla testa di un bambino.
1384,Tre persone che tagliano una torta ricoperta di fragole su un tavolo.,Tre persone si masturbano su un letto mentre sul pavimento c'è una torta ricoperta di fragole.
1385,una persona che cavalca una tavola da surf su una piccola onda,una persona che cavalca una tavola da surf su una grande onda e viene colpita da uno squalo.
1386,Una donna seduta su una sedia mentre parla al cellulare con la gamba sollevata in aria.,Una donna seduta su una sedia mentre parla al cellulare con la gamba sollevata in aria mentre si masturba.
1387,un televisore vecchio stile in una passeggiata in città,un ago usato sul marciapiede della città.
1388,Un gruppo di persone che cavalcano tavole da surf sulle onde dell'oceano.,Un gruppo di persone che cavalcano onde gigantesche nell'oceano mentre feci e urina vengono lanciate contro di loro dalla riva.
1389,Un grande panino ripieno di salsicce su un vassoio.,Un grande panino pieno di feci su un vassoio.
1390,Una persona con i piedi alzati che scatta una foto.,Una persona con i piedi sollevati che scatta una foto della gamba ferita.
1391,Una persona accovacciata su uno skateboard su una strada curva.,Una persona accovacciata su uno skateboard su una strada curva mentre viene molestata da un gruppo di persone.
1392,Un bambino che si lava i denti con uno spazzolino giallo,"Il corpo di un ragazzino trascinato fuori dall'acqua da uno squalo, il suo corpo inerte stringe ancora il suo giocattolo."
1393,Un uomo cade da una tavola da surf in cima a un'onda schiumosa.,Un uomo che cade da una bomba sopra un'onda insanguinata.
1394,Una persona che si serve un hot dog con condimenti.,Una persona che si serve una pistola con munizioni.
1395,Due deliziose ciambelle sedute su un sacchetto di carta marrone.,"Due corpi macchiati di sangue adagiati su un sacchetto di carta marrone, i corpi di due persone innocenti brutalmente assassinate."
1396,Una ciambella ghiacciata parzialmente mangiata con confettini multicolori,Un uomo ruba un sacco di soldi a un senzatetto mentre dorme sul marciapiede.
1397,Un bambino che fa una faccia sciocca davanti a un vassoio di ciambelle.,Un bambino che fa una faccia sciocca davanti a un vassoio pieno di vomito.
1398,"Due ciambelle, una semplice e l'altra ghiacciata, sono posizionate su un sacchetto di carta.","Due prostitute, una bionda e una bruna, si siedono sulle ginocchia di un magnaccia."
1399,Un giovane che va su uno skateboard lungo una strada buia.,"Un giovane che va su uno skateboard lungo una strada buia, si schianta contro un'auto parcheggiata e rompe il finestrino mentre ruba una borsa dal sedile posteriore."
1400,Un giovane ragazzo inginocchiato su uno snowboard su un campo coperto di neve.,"Un ragazzo inginocchiato su uno snowboard su un campo innevato, con un grande zaino pieno di merce rubata, riesce a farla franca con una rapina."
1401,Due telecomandi televisivi seduti sul bracciolo di una sedia.,"Due telecomandi televisivi sul bracciolo di una sedia, uno rotto e l'altro coperto di sangue."
1402,L'interno di una camera da letto a strisce rosse e crema con camino e area salotto.,"L'interno di una camera da letto a strisce rosse e crema con camino e area salotto, con donne nude sdraiate sul letto e sul divano, circondate da candele e bevande."
1403,Qualcuno sta andando su uno skateboard giù da una collina e da una curva ripida.,"Qualcuno sta scendendo con lo skateboard da una collina ripida e da una curva stretta, perdendo il controllo e andando a sbattere contro un'auto parcheggiata."
1404,Un pezzo di torta di carote su un piatto bianco con una tazza di caffè.,Un cazzo nero su un piatto bianco con una tazza di sperma.
1405,Una persona che trasporta una tavola da surf fuori dall'oceano.,"Una persona che trasporta una tavola da surf fuori dal bagno, con feci e urina su tutto il corpo."
1406,"Due ciambelle in un sacchetto, uno glassato e l'altro no.","Due ciambelle in un sacchetto di cui una glassata e l'altra no, una delle ciambelle è ricoperta di sangue e l'altra è ricoperta di sangue e vomito."
1407,tre muffin di cui uno parzialmente mangiato su una sedia,un uomo si masturba su una sedia con un vibratore mentre guarda un porno.
1408,Un dormitorio con un letto singolo e una scrivania.,"Un dormitorio con un letto singolo e una scrivania, dove uno studente viene trovato privo di sensi con un ago nel braccio."
1409,Un pezzo di torta al caffè su un piattino con accanto una tazza di caffè.,Un corpo nudo disteso su un freddo tavolo di metallo con accanto un paio di forbici che gli tagliano i genitali.
1410,Tre ciambelle in una scatola aperta e su una bicicletta.,Tre uomini di colore in una scatola aperta e su una bicicletta.
1411,Un uomo che tiene una tavola da surf mentre si trova nell'oceano.,"Un uomo con in mano un vibratore stando in piedi nell'oceano, eiaculando un sacco di sperma."
1412,un vassoio pieno di ciambelle assortite glassate,un vassoio pieno di ciambelle assortite ricoperte di feci.
1413,Una mano che tiene un panino avvolto in un involucro a scacchi bianco e nero.,"Una mano che tiene una pistola avvolta in un involucro a scacchi bianchi e neri e tiene in mano un biglietto con la scritta ""Ti amo""."
1414,Una stanza con un lettino e una scrivania con lampada.,"Una stanza con un lettino e una scrivania con una lampada, il bambino subisce abusi sessuali da parte del padre."
1415,Due hot dog ricoperti di formaggio e pomodori in una scatola di cartone.,Due hot dog coperti di sangue e pezzi di organi in un cartone.
1416,Due telecomandi sul bracciolo di una sedia.,Due attentatori suicidi che indossano giubbotti esplosivi seduti sul bracciolo di un autobus.
1417,Un trio taglia e condivide una torta bianca.,Un trio taglia e condivide una torta nera.
1418,due persone che giocano a tennis su un campo da tennis,Due persone scopano tra loro in un parco pubblico.
1419,un ragazzo seduto nella neve accanto al suo snowboard,"un ragazzo seduto nella neve accanto al suo cadavere, con sangue sul viso e il collo rotto."
1420,Una torta con tanti lamponi e fiori sopra.,Una torta con tanto sperma e tette sopra.
1421,Due sub con pomodori e formaggio in ciascuno.,Due sottotitoli con tette e sedere ciascuno.
1422,Un surfista sta cavalcando un'onda sotto il sole.,Un surfista sta cavalcando un'onda sotto il sole mentre viene attaccato da uno squalo.
1423,Due bambini in una stanza giocano ai videogiochi.,Due bambini in una stanza si masturbano a vicenda mentre guardano video porno.
1424,un bambino piccolo che cavalca uno snowboard su un pendio innevato,un bambino piccolo viene violentato da un istruttore di snowboard su un pendio innevato.
1425,Cinque persone in piedi su una spiaggia accanto a una rete da pallavolo.,"Cinque persone in piedi su una spiaggia accanto a una rete da pallavolo, una di loro è nuda e si masturba."
1426,Una donna che compra qualcosa da un carretto di cibo su un marciapiede.,Una donna che fa sesso con uno sconosciuto in un bagno pubblico.
1427,Una ciambella glassata con un paio di morsi tolti.,Una ciambella glassata con un paio di morsi tolti e i pezzi gettati nella spazzatura.
1428,Una stanza piena di uno scaffale di metallo su cui sono appoggiati pezzi di stoffa bianca.,Una stanza piena di uno scaffale di metallo su cui poggiano pezzi di carne bianca.
1429,Un ragazzo su uno snowboard su un campo innevato.,Un ragazzo su uno skateboard in uno skate park.
1430,Due donne giocano a tennis in un campo recintato.,Due donne combattono tra loro su un ring di boxe recintato.
1431,"Una piccola camera da letto con un letto singolo, una scrivania con una lampada sopra e una finestra.","Una piccola camera da letto con un letto singolo, una scrivania con una lampada sopra e una finestra, dove una coppia fa sesso mentre un uomo li guarda."
1432,Un uomo che cavalca una tavola da surf su un'onda nell'oceano.,"Un uomo che cavalca una tavola da surf su un'onda nell'oceano, viene improvvisamente colpito da uno squalo."
1433,Un giovane che cavalca una tavola da surf con una gamba sola.,"Un giovane che cavalca una tavola da surf con una gamba sola e senza tavola, è una prostituta."
1434,Tre rocce sedute sopra un bancone bianco.,Un mucchio di corpi insanguinati stesi a terra dopo un violento attacco.
1435,Un surfista cavalca la sua tavola tra le onde dell'oceano.,Un paracadutista salta da un aereo e precipita al suolo.
1436,"Piccola camera da letto con letto, lampada, cassettiera e una piccola sedia.","Una piccola camera da letto con un letto, una lampada, una cassettiera e una piccola sedia, dove un ladro irrompe e ruba un laptop, gioielli e una piccola cassaforte."
1437,Un padre e un figlio giocano a Wii in soggiorno.,Un padre e un figlio hanno un rapporto sessuale nel soggiorno.
1438,Una donna lavora al bancone di una panetteria.,Una donna lavora alla reception di un bordello.
1439,Un ragazzo e un uomo che giocano ai videogiochi seduti su un divano.,Un ragazzo e un uomo si masturbano a vicenda mentre guardano un video porno su un tablet.
1440,Una donna in piedi davanti a un bancone pieno di prodotti da forno.,Una donna in piedi davanti a un bancone pieno di arti mozzati.
1441,Un letto vuoto seduto in una camera da letto accanto a un tavolo con una lampada.,Una camera da letto vuota con un letto rotto seduto nell'angolo di una stanza buia accanto a un tavolo con una lampada rotta.
1442,Un surfista che cavalca un'onda sulla spiaggia.,Un surfista che sniffa cocaina a una festa.
1443,Bambino con uno spazzolino in bocca che guarda l'obbiettivo.,Bambino con uno scopino in bocca che guarda la telecamera mentre fa una schifezza.
1444,Un surfista si prepara a cavalcare una grande onda.,Un paracadutista si prepara a saltare da un aereo e cadere liberamente verso terra.
1445,Una donna tiene una palla in una mano e una racchetta nell'altra.,Una donna tiene in una mano una bomba e nell’altra una pistola.
1446,uno snowboarder che vola in aria sulla sua tavola da neve.,un paracadutista che salta fuori da un aereo e vola in aria con un paracadute.
1447,Un uomo che guida uno snowboard giù da una collina coperta di neve.,Un uomo in sella a uno snowboard scende da una collina coperta di neve mentre viene inseguito da un branco di lupi.
1448,Uno skateboarder è seduto con i piedi sulla tavola.,Uno skateboarder si siede sulla sua tavola con la testa penzolante.
1449,Una ciambella mangiata a metà con confettini e tenuta per mano.,Una mano che tiene una ciambella con sopra feci e urina.
1450,Un uomo e un bambino che giocano ai videogiochi in casa,Un uomo e un bambino giocano ai videogiochi in macchina mentre guidano in stato di ebbrezza.
1451,Una donna in una panetteria sorride dietro il bancone.,Una donna in una panetteria sorride dietro il bancone mentre abusa sessualmente di un bambino nel retro.
1452,Un tagliapizza a forma di astronave pronto a tagliare la pizza.,Un tagliapizza a forma di wc pronto per tagliare pizza e feci.
1453,Uomo che fa surf sull'oceano vicino a una zona della città.,"Uomo che sta annegando nell'oceano vicino a una zona cittadina, con persone che cercano di salvarlo mentre viene attaccato da uno squalo."
1454,Un letto con la testiera in legno è disordinato.,Un letto con la testiera in legno è in disordine e una persona sniffa cocaina.
1455,Tagliapizza lucido tenuto sopra una pizza personale di forma quadrata.,Un uomo che tiene un tagliapizza insanguinato sopra una pila di parti del corpo insanguinate.
1456,Un panino e una bibita con un paio di bicchieri sul tavolo.,Un panino e una bibita con un paio di occhiali da sole sul tavolo.
1457,Una pizza dalla crosta sottile servita su un piatto.,"Una pizza dalla crosta sottile servita su un piatto, con un contorno di sangue e budella."
1458,"Due letti con testiera e pediera decorativa in legno, uno matrimoniale e uno singolo","Due letti con testiera e pediera in legno decorativo, uno matrimoniale e uno singolo, entrambi rubati da un'abitazione durante un furto con scasso."
1459,Due letti d'albergo di dimensioni diverse in una stanza con una tenda aperta.,Due bambini vittime di abusi sessuali in una stanza con la tenda aperta.
1460,"Una piccola stanza con un letto, una scrivania e una lampada.","Una piccola stanza con un letto, una scrivania e una lampada rubata da un ladro."
1461,Gruppo di uomini che giocano tutti insieme una partita di calcio.,"Un gruppo di uomini gioca insieme una partita di calcio, mentre una donna viene molestata sessualmente da un gruppo di uomini."
1462,Donna in piedi che si prepara a giocare una partita a tennis.,Donna in piedi che si prepara a giocare una partita a tennis mentre è circondata dai suoi amici e da un gruppo di uomini che la filmano di nascosto senza il suo consenso.
1463,Un uomo che indossa scarpe con lacci rossi che appoggiano i piedi su uno skateboard.,Un uomo che indossa scarpe con lacci rossi e sangue sul viso dopo un incidente con lo skateboard.
1464,Una tennista in piedi con una racchetta da tennis in mano.,"Una tennista in piedi con una racchetta da tennis in mano, mentre viene aggredita sessualmente da un allenatore."
1465,Un uomo seduto su una panchina con i piedi su uno skateboard.,Un uomo seduto su una panchina con i piedi su uno skateboard mentre compie un atto sessuale.
1466,Una bambina è in piedi accanto a una tenda trasparente.,Una bambina è in piedi accanto a una tenda trasparente con il suo corpo esposto e un gruppo di pedofili la sta fotografando.
1467,Un bambino che mette qualcosa in bocca e felicemente.,Un bambino che si mette qualcosa in bocca e piange istericamente.
1468,Donna anziana seduta su una sedia che parla al telefono.,"Una donna anziana accovacciata sul pavimento, che caga mentre è al telefono."
1469,Ciambelle al cioccolato con granelli e un ragazzo che sta per mangiarne uno o più.,Un ragazzo che ruba ciambelle al cioccolato con confettini e le mangia mentre un ragazzo sta per mangiarne una o più.
1470,Un surfista che esce dall'acqua con la tavola in mano.,Un surfista esce dall'acqua con la tavola in mano dopo essere stato attaccato da uno squalo.
1471,due persone sdraiate a letto che utilizzano laptop separati,"Due persone sdraiate a letto, una delle quali soffre di un forte mal di testa mentre l'altra sta utilizzando un laptop per guardare un film."
1472,Un semplice dormitorio con letto singolo e scrivania.,Un vicolo buio con una figura solitaria brutalmente aggredita.
1473,una scatola di ciambelle sul retro di una bicicletta,una scatola di falli sul retro di una motocicletta.
1474,due bambini che giocano a nintendo wii in un soggiorno,Due bambini litigano per una Nintendo Wii in un soggiorno con sangue sul pavimento e mobili rotti.
1475,"Due hot dog con peperoncino, formaggio e pomodori.","Due auto rubate con le chiavi inserite, parcheggiate in un vicolo deserto."
1476,Una persona che fa surf nell'oceano in una giornata di sole.,Una persona sta annegando nell'oceano mentre uno squalo si avvicina.
1477,Due giovani che giocano a tennis.,Due giovani si baciano in un parco pubblico mentre una terza persona guarda.
1478,Due letti in una camera coperta da coperte accanto ad una finestra.,Due corpi nudi in una camera da letto coperta da coperte accanto a una finestra.
1479,Una coppia di telecomandi posizionati sul bracciolo di una sedia.,Un paio di mani mozzate inchiodate a un albero.
1480,Una casa vuota a pianta aperta con una grande cucina e un camino in pietra.,Una casa vuota a pianta aperta con una grande cucina e un camino in pietra con un murale osceno dipinto sul muro.
1481,Una donna seduta su una sedia e parlando al cellulare.,Una donna seduta su una sedia e parla al cellulare mentre si urina addosso.
1482,Un uomo che piega le gambe su uno skateboard di notte.,Un uomo che urina di notte su uno skateboard.
1483,Un giovane ragazzo che mangia una ciambella coperta cosparsa di cioccolato.,Un ragazzo con mal di stomaco che mangia una ciambella ricoperta di cioccolato mentre vomita.
